2018-02-21	https://www.cnn.com/2018/02/21/politics/jeff-flake-ar-15-age-bill/index.html	Flake backs bill to raise age to buy AR-15 style weapons	15	1	Texas	"  (CNN) Republican Sen. Jeff Flake announced Wednesday he's backing a bill to increase the minimum age to buy a semi-automatic rifle, lending bipartisan support to legislation that was introduced last week by Democratic Sen. Dianne Feinstein in the wake of the mass shooting at a high school in Parkland, Florida. Legislative proposals that prevent law-abiding adults aged 18-20 years old from acquiring rifles and shotguns effectively prohibits them for purchasing any firearm, thus depriving them of their constitutional right to self-protection,"" said Jennifer Baker, the NRA public affairs director."	9	6
2017-10-25	https://www.cnn.com/2017/10/24/politics/jeff-flake-retirement-arizona/index.html	Flake's speech burning Trump gets standing ovation from some Republicans	11	1	Virginia	" Washington (CNN) Republican Sen. Jeff Flake of Arizona, a frequent critic of President Donald Trump, will not run for re-election, he said Tuesday in a blistering speech on the Senate floor that bemoaned the ""coarsening"" tenor of politics in the United States. ""If I have been critical, it's not because I relish criticizing the behavior of the President of the United States,"" Flake said. ""It's difficult to move forward in a Republican primary if you have been critical of any of the behavior that's gone on,"" Flake said on CNN's ""The Lead."" And it turns Arizona -- once a Republican stronghold but increasingly competitive in recent elections -- into perhaps the most important state in the 2018 midterms, with Flake's seat now open and questions looming about Sen. John McCain's long-term prognosis as he is treated for brain cancer. ""One of the greatest people I've served with,"" Corker said after the speech, describing Flake and adding later, ""He's what I would call a real conservative."" Sen. John Cornyn, the second ranking Republican in the chamber, said it is ""a very sad day"" and GOP Sen. Susan Collins of Maine, who recently decided to skip a run for governor and stay in the chamber, said she was ""incredibly disappointed"" by Flake's decision. RELATED: In Arizona, it's Flake vs. Trump in a test of the GOP's allegiances In the book, Flake worries about ""the strange specter of an American president's seeming affection for strongmen and authoritarians."" The fight in Arizona Flake's decision opens the door for Ward, a conservative former state senator who many Arizona Republicans see as a controversial and problematic general election candidate. As Republicans look for another candidate to enter the primary, all eyes are now on DeWit, who was the Trump campaign's chief operating officer, one Arizona Republican operative said."	40	6
2018-01-26	https://www.cnn.com/2018/01/26/politics/immigration-border-wall-daca-trump-congress/index.html	Forget the wall, Trump's plan would reshape US legal immigration dramatically	11	1	Virginia	" In addition, the administration proposal included a number of ""legal loopholes"" it wants to close in the border security pillar beyond physical security -- a repackaged effort to expand federal immigration authorities. Democratic Sen. Tim Kaine of Virginia, who is part of a bipartisan Senate group working to find common ground on the issue, had said earlier Thursday that while a full border wall is not acceptable, a major investment in border security is. Thorny proposals The White House proposal would limit family sponsorship to spouses and minor children, eliminating a number of existing categories including adult children, both married and unmarried; parents of adult US citizens; and siblings of adult US citizens. At first, the Trump proposal would use the green cards from the eliminated categories -- plus the 50,000 from the eliminated diversity visa lottery -- to work through a backlog of millions of people waiting in a line upward of 30 years long for their green cards. And the framework includes vague references to closing ""legal loopholes,"" as a White House official put it on a briefing call, as part of the border security pillar -- perhaps one of the biggest poison pills of the deal. ""I am a lot less interested in things that have the effect of distorting family relationships or splitting up families, and border security is less likely to do that,"" said Democrat Michael Bennet of Colorado, who has long pursued an immigration compromise."	75	5
2018-03-17	https://www.cnn.com/2018/03/17/politics/john-brennan-donald-trump-mccabe-firing/index.html	Former CIA chief to Trump on McCabe firing: 'America will triumph over you'	11	1	Virginia	" Washington (CNN) Former CIA Director John Brennan blasted President Donald Trump on Saturday after he tweeted about the firing of former FBI Deputy Director Andrew McCabe, calling the President ""a disgraced demagogue."" Following Dowd's remarks, Sen. Patrick Leahy again demanded Senate Judiciary Committee Chairman Chuck Grassley hold a hearing on what he called the politicization of the Justice Department. ""In the last few hours the President's personal attorney has called for the Justice Department, without even an arguably legitimate basis, to prematurely shut down the special counsel's Russia investigation,"" the Vermont Democrat said in a statement. ""And the attorney general, in a clear violation of his promised recusal under oath before the Senate Judiciary Committee, fired a career civil servant days before he could retire, following months of the President's relentless and outrageous prodding."" Leahy sent a letter to Grassley in late January asking the Iowa senator to hold a hearing on the attacks on FBI and its leaders, writing: ""Never before have I been more concerned for the institutions we rely on to maintain our government's integrity than I am today."" ""Mr. Dowd's comments are yet another indication that the first instinct of the President and his legal team is not to cooperate with special counsel Mueller, but to undermine him at every turn,"" the New York Democrat said in the statement. ""The President, the administration, and his legal team must not take any steps to curtail, interfere with, or end the special counsel's investigation or there will be severe consequences from both Democrats and Republicans."" Warner's Virginia colleague, Democratic Sen. Tim Kaine, also  tweeted  a warning about Dowd's remarks."	40	6
2014-06-05	http://www.foxnews.com/politics/2014/06/04/forty-one-senators-push-for-repeal-obamas-cap-and-trade-rule.html	Forty-one senators push for repeal of Obama’s cap-and-trade rule	3	2	West_Virginia	 “When I’m in the U.S. Senate, I will fiercely oppose the President’s attack on Kentucky’s coal industry because protecting our jobs will be my number one priority.” In West Virginia, Democratic Rep. Nick Rahall faces a tough reelection battle this year against Republican candidate Evan Jenkins who has repeatedly attacked Rahall for not fighting back against EPA rules.	14	1
2013-03-01	http://www.foxnews.com/politics/2013/03/01/frustration-confusion-mount-in-wakeice-illegal-immigrant-releases.html	Frustration, confusion mount in wake ICE illegal immigrant releases	17	2	Texas	 “We have a good working relationship with ICE in this area and don’t see any cause for concern over the recent decision to release detainees,” said Jan Caldwell, spokeswoman, Sam Diego County Sheriff’s Department. Rep. Beto O'Rourke (D-Texas) of El Paso, Texas, who sits on the House Committee on Homeland Security with McCaul, told   there is bi-partisan agreement that there are too many people being detained in ICE facilities that don't belong there and that the decision this week by Napolitano to release low-risk detainees as a cost-saving measure may actually be a harbinger for where the federal immigration policy should be heading.	50	5
2018-02-06	https://www.cnn.com/2018/02/06/politics/kfile-sasse-ambassador-statement/index.html	GOP Senate office rips Trump nominee: 'Cynics and nuts' will have hard time securing confirmation	15	1	Texas	 CNN's KFile reported on Monday that Leandro Rizzuto Jr., Trump's nominee to be the US Ambassador to Barbados and several other Caribbean countries, frequently retweeted conspiracy theories and rumors about Sen. Ted Cruz and his wife Heidi, Wisconsin Gov.	48	8
2018-03-16	https://www.cnn.com/2018/03/16/politics/jeff-flake-new-hampshire-speech/index.html	GOP senator in New Hampshire: I hope a Republican runs against Trump	15	1	Texas	" Manchester, New Hampshire (CNN) Republican Sen. Jeff Flake, a vocal critic of President Donald Trump, delivered a series of verbal blows against the President while making a stop in the early primary state of New Hampshire as he continues to mull a possible GOP challenge in 2020. The senator from Arizona, who was facing a tough re-election bid and  decided not to run for a second term , spoke at the Politics & Eggs series, a must-do stop for potential presidential contenders hosted by the New England Council and the New Hampshire Institute of Politics at Saint Anselm College. In the year leading up to the 2016 New Hampshire primary, 18 candidates or potential candidates spoke at the event, including Trump, who would go on to win the state's GOP primary by a landslide. In his speech, which resembled remarks he gave at the National Press Club on Thursday in Washington,  Flake described Trump as a ""chaotic"" President  who has ""no strategic brilliance"" and has damaged the country's institutions. Flake's anti-Trump crusade this past year has marked a stunning rebuke of a president from a senator of the same party, and while some Republicans have criticized the President, none have matched the degree to which Flake has scorched Trump. He told a small group of Republicans he was prepared to spend $10 million on defeating Flake in the primary, and he publicly offered support on Twitter for one of the senator's GOP challengers last year when it appeared Flake would run for re-election. According to a poll by the University of New Hampshire, 60% of Republican primary voters say they plan to vote for Trump in the  2020 GOP primary, as of last month. Fergus Cullen, a former New Hampshire state GOP chairman, noted that many incumbent presidents who have drawn serious primary challenges have failed to win re-election in the end: President Lyndon Johnson in 1968, President Jimmy Carter in 1980 and Bush in 1992. ""Right now I can say this is the President's party, Republican primary voters in Arizona and elsewhere are firmly with the president by large majorities, but I do think that will change,"" he told reporters."	54	8
2018-03-16	https://www.cnn.com/2018/03/14/politics/rand-paul-opposes-mike-pompeo-gina-haspel/index.html	GOP senator says he will oppose Pompeo and Haspel, complicating their paths to confirmation 	11	1	Virginia	" Washington (CNN) Republican Kentucky Sen. Rand Paul said Wednesday that he intends to oppose President Donald Trump's nominations of Mike Pompeo as secretary of state and Gina Haspel as the next CIA director, complicating their confirmation process in the Senate where Republicans have a very slim majority. ""I'm perplexed by the nominations of people who loved the Iraq War so much they advocate for war with Iran,"" Paul told reporters on Capitol Hill in explaining his opposition to the nominees. Paul sits on the Senate Foreign Relations Committee, where Republicans hold a one-seat advantage, so if Paul carries out his threat to vote ""no"" on Pompeo -- and all Democrats vote against him -- Senate Republican leaders would need to decide if they would move the nominations to the floor without committee approval. Senate Foreign Relations Committee Chairman Bob Corker, a Tennessee Republican, said that nominees can be reported out of committee for a floor vote with or without a recommendation -- and even with a negative recommendation. Republicans hold a narrow 51-49 advantage in the Senate, so Paul's opposition -- and possible opposition to Haspel from Arizona GOP Sen. John McCain -- means Republicans might need to rely on some support from Democrats. About Pompeo and Haspel, Paul said at his news conference their support for the Iraq War and Haspel's ""joyful glee"" of waterboarding prompted his move. Paul's comments are a reference to Haspel  being a CIA veteran who was intricately involved in the execution of George W. Bush-era CIA interrogation programs , including those carried out at a ""black site"" prison she reportedly ran. Paul said he has not spoken to the President about his opposition to Pompeo and Haspel, and that while he does support the President and his policies, ""Most of the people being appointed are still in favor of Iraq War,"" Paul said. Florida Republican Sen. Marco Rubio, a member of the committee, predicted both Haspel and Pompeo will be confirmed and added that shoring up stability at the top of the State Department needs to happen quickly. New Hampshire Sen. Jeanne Shaheen, one of two Democrats on the Senate Foreign Relations Committee that voted last year to confirm Pompeo to be CIA director, told CNN she now has ""concerns."" Sen. Tim Kaine of Virginia, the other Democrat on the committee who voted a year ago for Pompeo, told CNN on Wednesday he has ""a lot of concerns"" about elevating him to be secretary of state. While GOP leaders could still move the nomination to the full Senate for a vote -- where Pompeo might be able to get at least 51 votes to be confirmed -- failing to be approved by the committee could politically damage him, especially when an influential Democrat like Kaine who once backed him turns negative."	32	8
2017-04-18	https://www.cnn.com/2017/04/18/politics/kfile-george-w-bush-ed-gillespie/index.html	George W. Bush donates $25,000 to Ed Gillespie's campaign for Virginia governor	12	1	Virginia	  (CNN) Former President George W. Bush donated $25,000 to his past staffer Ed Gillespie, who is campaigning for the Republican nomination in Virginia's gubernatorial race. Bush donated $25,000 to Gillespie's political action committee last year and was a special guest at a fundraiser held for Gillespie in Dallas, Texas in March.	75	8
2017-03-28	https://www.cnn.com/2017/03/28/politics/george-w-bush-ed-gillespie-fundraiser/index.html	George W. Bush to attend fundraiser in support of Gillespie	12	1	Virginia	"  (CNN) Former President George W. Bush will attend a fundraiser this weekend in support of a Republican candidate for governor of Virginia, Ed Gillespie. The fundraiser will take place in Dallas, where the former president lives, and is expected to draw many big-money donors. He has rarely campaigned or raised money for any candidates aside from his brother, former Florida Gov. He's proud to have the support of President Bush and conservative leaders from across the commonwealth and the country,"" said Abbi Sigler, a Gillespie spokeswoman. ""This is a crucial campaign for Virginia Republicans, and Ed will work tirelessly to ensure we have the resources necessary to defeat Ralph Northam or Tom Perriello in November, and bring conservative leadership back to Richmond."" The fundraiser comes at a time when Gillespie has pulled away from the pack in a field of Republicans hoping to secure the GOP nomination. A  new poll  from Christopher Newport University shows Gillespie with a sizable lead in the primary over Corey Stewart, the chair of the Prince William County Board of Supervisors and State Senator Frank Wagner. Ralph Northam, who enjoys the support of all of Virginia's top elected democratic officials, is locked in a tight battle with former Congressman Tom Perriello. While Northam has the support of the Virginia Democratic infrastructure behind him, led by Gov. Terry McAuliffe, Perriello has pitched himself as the more authentic progressive -- highlighted by the revelation in The  New York Times  that before Northam became a candidate he voted for George W. Bush twice."	31	8
2017-06-14	https://www.cnn.com/2017/06/13/politics/virginia-governor-primary-results/index.html	Gillespie ekes out win in surprisingly close GOP Virginia primary	12	1	Virginia	 Washington (CNN) Ed Gillespie was expected to hold onto a narrow lead to win the Republican nomination for Virginia governor in his party's primary election Tuesday evening, CNN projected. Meanwhile, Northam's win capped off fierce competition on the Democratic side, where he faced off against former congressman Tom Perriello.	64	8
2015-11-17	http://www.foxnews.com/politics/2015/11/17/ginni-thomas-endorses-ted-cruz.html	Ginni Thomas endorses Ted Cruz	15	2	Texas	" ""I relish the opportunity to change this town, but what I really love are the people outside of this beltway of Washington and the people who see we can have a strong America again,"" Thomas said in a video of her endorsement released by the Cruz campaign. Ginni Thomas' political positions have caused some controversy in the past, mostly in regards to whether they create any conflict of interest for her husband, the Supreme Court justice."	100	8
2018-01-19	https://www.cnn.com/2018/01/18/politics/senate-whip-continuing-resolution-government-shutdown/index.html	Government shutdown: Where the senators stand	4	1	West_Virginia	" (Wednesday, to reporters)  Sen. Rand Paul (Kentucky) --  He said he's voting no. (Friday in a statement)   DEMOCRATS LEANING NO Sen. Michel Bennet (Colorado) --  ""I'm very, very unlikely to support that."" (Thursday, to reporters) Sen. Sherrod Brown (Ohio) --  ""I'm joining Republicans and Democrats who are calling on Leader McConnell to keep the government open with a clean CR for a few days and allow us to pass a solution that gives Ohio businesses, military installations and families the certainty they deserve."" (Friday on Twitter)  Sen. Patty Murray (Washington) --  ""There is absolutely no reason for the Republicans who control government to shut it down, and I am hoping they reverse course and work with us—today—to prevent that."" (Friday on CNN's ""New Day"") Sen. Sheldon Whitehouse (Rhode Island) --  ""Everything Democrats want is bipartisan; why not work with us? (Thursday on Twitter)  DEMOCRATS VOTING NO Sen. Richard Blumenthal (Connecticut) --  ""I'll vote against a short-term spending bill, the fourth in as many months, because it simply kicks the can down the road."" (Wednesday on CNN's ""New Day"") Sen. Cory Booker (New Jersey) --  ""I will vote against a clean CR if it does not include DACA, a fix to some of the other things that are high priorities to me. (Thursday to reporters) Sen. Tom Carper (Delaware) --  He will vote no, according to a spokeswoman. Sen. Bob Casey (Pennsylvania) --  ""It's time to pass a funding agreement that will help the middle class, not a bad deal cooked up by Washington Republicans and special interests."" (Thursday on Twitter)  Sen. Chris Coons (Delaware) --  ""This bill avoids solving our months-overdue challenge of adequately funding our military, which is already stretched too thin, and providing a balanced overall plan for spending. (Thursday in a statement)  Sen. Tammy Duckworth (Illinois) --  She will vote no, according to a spokesman. Sen. Dick Durbin (Illinois) --  ""Unless we pass the #DreamAct, I won't support another short-term funding bill. Sen. Maggie Hassan (New Hampshire) --  ""I will join my colleagues -- both Republicans and Democrats -- in opposing this four-week funding bill, and I will continue working for common-sense compromises that bring our cocuntry the security and stability we need."" Sen. Martin Heinrich (New Mexico) --  ""Members on both sides of the aisle have been working to reach agreement and meet our basic responsibilities, including veterans funding, disaster relief, and finally passing the Dream Act, but President Trump and his right-wing supporters in Congress seem intent on steering the country off a funding cliff. (Wednesday) Sen. Mazie Hirono (Hawaii) --  ""I will be voting no on the House CR because it does not include protections for Dreamers, funding for the Children's Health Insurance Program and Community Health Centers, and parity between defense and domestic spending."" (Thursday on Twitter) Sen. Tim Kaine (Virginia) --  ""We oppose the House continuing resolution, which punts budget discussions until mid-February. (Thursday on CNN's ""New Day"") Sen. Pat Leahy (Vermont) --  ""The House bill is a joke, and it does not have my support. (Thursday in a statement)  Sen. Ed Markey (Massachusetts) --  ""The Republicans in the House put their bill together ... without having any Democrats in the room ... so they are sending it over to the Senate with the expectation that the Democrats in the Senate are going to vote for a bill that they were never included in the negotiation, so of course we are not going to vote for it. (Thursday on Twitter)  Sen. Jeff Merkley (Oregon) --  He said the plan doesn't address Dreamers (Thursday to CNN) Sen. Gary Peters (Michigan) --  ""I am encouraged that members of Congress on both sides of the aisle have expressed a willingness to negotiate bipartisan solutions to these pressing issues. (Friday in a statement) Sen. Bernie Sanders (Vermont) --  ""Republicans control the House, Senate and White House. (Wednesday on Twitter) Sen. Debbie Stabenow (Michigan) --  ""She is focused on working with Republicans and Democrats to reach a long-term solution on government funding and believes that kicking the can down the road is hurting Michigan and is no way to do business,"" a spokeswoman said. (Twitter on Thursday)  Sen. Tom Udall (New Mexico) --  ""The Republicans' bill is irresponsible, and l can't support it. (Thursday on Twitter) Sen. Mark Warner (Virginia) --  ""We oppose the House continuing resolution, which punts budget discussions until mid-February."" Sen. Ron Wyden (Oregon) --  ""There is a bipartisan solution on DACA and many other important issues before Congress including funding for Secure Rural Schools, deadly wildfires and other natural disasters. (Wednesday in a statement) UNCLEAR -- BUT EITHER VOTED YES IN DECEMBER OR ARE NEW TO SENATE Sen. Doug Jones (Alabama) --  ""Still working, still trying to figure it all out."	51	6
