2018-01-12	https://www.cnn.com/2018/01/12/politics/white-house-immigration-meeting-conservatives/index.html	Trump's comments threaten already-delicate DACA talks	15	1	Texas	" Washington (CNN) President Donald Trump's demands on immigration legislation Friday morning threatened to upend delicate negotiations on Capitol Hill, which were already jeopardized  in the wake of his ""shithole"" remark . But if Trump's vulgar comments weren't already making moderates increasingly nervous that they're losing in the fight to pull Trump to the center, his tweets Friday, in which he listed demands for a DACA deal, were likely to make their efforts more difficult. Ready to brief Trump on their negotiations, Durbin and Graham traveled to the White House Thursday thinking they would be meeting privately with the President, a source familiar told CNN. The bipartisan group had spent months meeting and crafting their bill and while it was long-expected to find resistance among restrictionist immigration types, more moderate Republicans on immigration had tried to make the case to the President that it was -- Flake put it -- the only game in town. But the bipartisan ""Group of Six,"" which included many of the same players that negotiated the hard right's much maligned 2013 immigration bill -- was being squeezed even before Thursday."	51	5
2017-02-02	https://www.cnn.com/2017/02/02/politics/donald-trump-virginia/index.html	Trump's policies to face early test at the ballot box	12	1	Virginia		79	8
2018-03-23	https://www.cnn.com/2018/03/23/politics/trump-tweet-spending-bill-senate-republican-primaries/index.html	Trump's veto threat on spending bill gives ammo to conservative candidates in GOP primaries  	5	1	West_Virginia	" Washington (CNN) President Donald Trump's Friday tweet threatening to veto the $1.3 trillion spending bill has intensified a battle already being waged in key Republican Senate primaries over the measure. In three states -- Arizona, West Virginia and Indiana -- right-wing candidates had already staked out their opposition to the bill. But Trump's tweet has given them a new opening to cast their opponents -- all House members who voted for the bill -- as being on the wrong side of the Trump agenda. In West Virginia, Attorney General Patrick Morrisey, who along with former coal baron Don Blankenship is running against Rep. Evan Jenkins in a May Senate primary, said Trump should veto the bill. Congress & Evan Jenkins caved on the wall, paved the way for more gun control, and give money to Planned Parenthood. In Arizona, state Sen. Kelli Ward had already blasted Rep. Martha McSally for her vote, tweeting Thursday night: ""Want to know the difference between me and my opponent @RepMcSally? Try her vote today in favor of a $1.3 trillion-dollar spending bill that doesn't include funding for a new #BorderWall but continues to fund #SanctuaryCities."" Friday morning, she retweeted Trump, thanking him and saying she was ""working hard so you have a conservative"" from Arizona to help his agenda. In Indiana, Rep. Todd Rokita -- who voted against the bill, calling it ""the Washington swamp at its worst"" -- retweeted Trump, signaling that he intended to use the issue against Rep. Luke Messer, a leading primary foe who voted for it. Later, he tweeted his criticism of the bill, saying it ""did not include the priorities"" of Trump and Hoosiers. In Ohio as well, Mike Gibbons, a Republican running in the Senate primary against Rep. Jim Renacci, is hitting Renacci on the spending bill -- even though Renacci voted against it. Gibbons' argument is that Renacci, as a House Budget Committee member, is responsible for the product. ""The budget bill that just passed spends money we don't have, fails to fund the wall, but does fund Planned Parenthood. Jim Renacci can't hide his failure and ineffectiveness behind a 'no' vote on the floor,"" Gibbons said. Gibbons on Friday morning retweeted Kentucky Sen. Rand Paul, who tweeted: ""I agree @realDonaldTrump should veto this sad excuse for legislation because it's $1.3 trillion in spending that (almost) no one read."""	42	6
2018-01-11	https://www.cnn.com/2018/01/11/politics/donald-trump-immigration-gop/index.html	Trump, Republicans face immigration reckoning	15	1	Texas		71	5
2016-10-10	http://www.foxnews.com/politics/2016/10/10/ryan-says-wont-campaign-for-trump-defend-him.html	Trump, Ryan clash as House speaker vows not to campaign with nominee	12	2	Virginia		67	8
2017-10-27	https://www.cnn.com/2017/10/27/politics/trump-campaign-wikileaks-cambridge-analytica/index.html	Trump. Cambridge Analytica. WikiLeaks. The connections, explained.	15	1	Texas	" This week, a new thread emerged: Multiple sources confirmed to CNN that the chief executive of Cambridge Analytica, Alexander Nix, contacted WikiLeaks founder Julian Assange in summer 2016 to ask for access to emails from Hillary Clinton's private server. July 2015 -- Russian hackers breach DNC systems Hackers working for Russian intelligence services ""gained access to"" the Democratic National Committee's computer networks as part of the Kremlin's campaign to interfere in the 2016 presidential race, according to the  US intelligence community assessment  that was published after the election. March 2016 -- Another group of Russian hackers breach DNC systems Another group of Russian hackers -- separate from the group that hacked the DNC in 2015 -- breached the DNC's computer systems, according to a  US intelligence report  published after the election. March 19, 2016 -- Russian hackers gain access to Podesta's emails Russian hackers gained access to Clinton campaign chairman John Podesta's personal Gmail account by sending a phishing email. Between July 21 and July 31, 2016 -- Cambridge Analytica CEO emails WikiLeaks Alexander Nix, the chief executive of data firm Cambridge Analytica, emailed Assange  seeking access to emails from Clinton's private server  so he could turn them into a searchable database for the campaign or a pro-Trump political action committee.There is no evidence that Clinton's deleted emails were ever hacked or that WikiLeaks ever had possession of them. July 25, 2016 -- Trump says it's a ""joke"" that Russia hacked the DNC  Trump weighed in on the DNC leaks,  saying on Twitter : ""The new joke in town is that Russia leaked the disastrous DNC e-mails, which should never have been written (stupid), because Putin likes me."" July 27, 2016 -- Trump publicly asks Russia to hack Clinton's deleted emails At a news conference , Trump publicly called on the Russian government to hack Clinton's private email server and reveal the deleted emails. July 29, 2016 -- Trump campaign pays $100,000 to Cambridge Analytica The Trump campaign made its first of five payments to Cambridge Analytica, cutting a check for $100,000, according to records from the Federal Election Commission. August 8, 2016 -- Roger Stone says he was in touch with Assange During a speech in Florida , former Trump campaign adviser Roger Stone claimed to be in touch with Assange and predicted upcoming WikiLeaks releases:  ""I actually have communicated with Assange. Months after these Twitter messages, the US intelligence community announced that Guccifer 2.0 was actually run by Russian intelligence operatives as part of the Kremlin's effort to meddle in the election. August 18, 2016 -- Trump campaign pays $250,000 to Cambridge Analytica The Trump campaign made its second of five payments to Cambridge Analytica, cutting a check for $250,000, according to records from the Federal Election Commission. September 1, 2016 -- Trump campaign pays $5 million to Cambridge Analytica The Trump campaign made its second of five payments to Cambridge Analytica, cutting a check for $5 million, according to records from the Federal Election Commission. Months after these Twitter messages, the US intelligence community announced that Guccifer 2.0 was actually run by Russian intelligence operatives as part of the Kremlin's effort to meddle in the election. October 3, 2016 -- Stone again predicts upcoming WikiLeaks releases ""I have total confidence that @wikileaks and my hero Julian Assange will educate the American people soon,""  Stone tweeted , four days before WikiLeaks began releasing Podesta's emails. October 7, 2016 -- WikiLeaks begins releasing Podesta emails Shortly after the announcement blaming Russia for the DNC hacks, WikiLeaks  began posting thousands of emails  stolen from Podesta's Gmail account. October 19, 2016 -- Trump campaign pays $250,000 to Cambridge Analytica The Trump campaign made its fourth of five payments to Cambridge Analytica, cutting a check for $250,000, according to records from the Federal Election Commission. December 12, 2016 -- Trump campaign pays $312,500 to Cambridge Analytica With the presidential transition underway, the Trump campaign made its final payment to Cambridge Analytica, cutting a check for $312,500, according to records from the Federal Election Commission."	54	6
2017-06-24	https://www.cnn.com/2017/06/23/politics/trump-mueller-pelosi/index.html	Trump: 'Bothersome' that Mueller is 'very good friends' with Comey	15	1	Texas	"  (CNN) President Donald Trump said ""we're going to have to see"" when asked about the future of Special Counsel Robert Mueller, who is  reportedly  investigating whether Trump attempted to obstruct justice. Deputy Attorney General Rod Rosenstein later appointed Mueller, a former FBI director, as special counsel to oversee the investigation, including potential collusion between Trump's campaign associates and Russian officials. In other comments in the full interview on Fox, which aired Friday morning, Trump reiterated how ineffective Democrats and House Minority Leader Nancy Pelosi have been at winning elections. In special elections for House seats vacated by Republicans who wound up in Trump's Cabinet, Democrats  have gone 0-for-4 , losing races in Georgia, Montana, South Carolina and Kansas. On health care, Trump said he believes he will win over Republican lawmakers who have pledged to vote  against  the GOP bill to replace the Affordable Care Act."	48	6
2016-11-28	https://www.nytimes.com/2016/11/28/us/donald-trump-coal-country.html	Trump’s Promises Will Be Hard to Keep, but Coal Country Has Faith	2	3	West_Virginia	 WILLIAMSON, W.Va. — If a single moment captured coal country’s despair this year, it was when Bo Copley, a soft-spoken, out-of-work mine maintenance planner, fought tears as he asked Hillary Clinton how, having dismissed coal’s future in language that came back to haunt her, she could “come in here and tell us you’re going to be our friend.” That was in May. As Mr. Copley put it, “Coal is secondary to me.” It is difficult for outsiders to fathom how deeply faith and work are intertwined here, or the economic and psychological depression that sets in when an entire region loses the only livelihood many of its people have ever known. “We’re a forgotten people,” Ms. Taylor said, explaining why it did not take much for Mr. Trump to win coal country’s trust. “He mentions West Virginia, he mentions the coal workers, and that was pretty much all he had to do to seal this deal.” Now that the deal has been sealed, Mr. Trump has put a  climate change contrarian  and friend of the coal industry in charge of his Environmental Protection Agency transition team. His children’s drama teacher, Dusty Smith, 36, who has purple and blue streaks in her hair, said she had voted for Mr. Trump because he seemed “very humble” on  “The Tonight Show Starring Jimmy Fallon.”  At the Thanksgiving play Ms. Smith directed, an African-American teenager delivered a spoken-word homage to racial harmony.	37	6
2015-12-23	http://www.foxnews.com/health/2015/12/23/u-s-lawmakers-call-for-action-to-protect-drug-exposed-newborns.html	U.S. lawmakers call for action to protect drug-exposed newborns	3	2	West_Virginia	 ADVERTISEMENT Senator Robert Casey of Pennsylvania, the top Democrat on the children and families subcommittee, is calling for oversight hearings, in part to understand why a longstanding federal law directing states to safeguard the newborns is not being enforced. Despite a 12-year-old federal law that calls on states to protect drug-dependent newborns, Reuters found that thousands of babies born to mothers who use opioids during pregnancy are being sent home without social-service evaluations and safe-care plans - requirements under the Keeping Children and Families Safe Act.	47	2
2017-10-25	https://www.cnn.com/2017/10/25/politics/myanmar-lawmakers-outrage-ethnic-cleansing/index.html	US lawmakers push for action on Myanmar atrocities	11	1	Virginia	" Hundreds of women, children and men belonging to the Rohingya Muslim minority have been ""systematically killed"" and driven from their homes, their villages burned to the ground by Myanmar's military, lawmakers charged. Meanwhile, they complained, the US has made no major change to its ties to Myanmar (also known as Burma), and its officials have shied away from legal terms such as ""ethnic cleansing"" or ""crimes against humanity"" despite what many say is strong evidence. ""In recent weeks, we've also witnessed the appalling images of atrocities being committed by the Burmese military against  the Rohingya minority ,"" said Sen. Bob Corker, chairman of the Senate foreign relations committee, at a hearing Tuesday to examine the US policy toward Myanmar. Murphy, who had earlier in the day testified about policy towards Myanmar before Corker's committee, was asked by reporters about the State Department's consideration of terms like ethnic cleansing, crimes against humanity or genocide. Lawmakers in the House and Senate have proposed a series of new sanctions on Myanmar's military, which, Corker noted, ""continues to control key ministries and large swaths of the economy,"" even after a 2015 election brought the democratic opposition to power and with it, activist Aung San Suu Kyi, who is now the country's de factor leader. ""Her failure to acknowledge the seemingly systematic campaign of brutality by the Burmese military continues to undermine the civilian government and Burma's democratic transition as a whole,"" said Corker, describing his ""shock and dismay at her dismissiveness"" of concerns about what has been happening to Rohingya. Murphy said that Trump has discussed this situation with other leaders, that Tillerson had spoken by phone with Suu Kyi to urge action on this crisis, that Pence and US Ambassador to the United Nations Nikki Haley had denounced the military's response at the UN, and that the US ambassador in Myanmar has been discussing the violence with government and military leaders. US officials have pointed out that ""these kind of abuses, this kind of displacement,"" not only threatens the transition to democracy, but it ""creates a much bigger risk for the attraction of international terrorism"" if the plight of the Rohingya becomes a rallying cry for militant Islamic groups, Murphy said. Pushed by Maryland Sen. Ben Cardin, the ranking Democrat on the committee, to say that ethnic cleansing is taking place, Murphy said that he wasn't in a position to make that determination, but that it was under consideration."	32	6
2017-11-06	https://www.cnn.com/2017/11/05/politics/lawmakers-sutherland-church-shooting-reactions/index.html	US leaders react to Texas church shooting	15	1	Texas	"  (CNN) US leaders reacted with horror and sorrow to the mass shooting Sunday at a Baptist church in Sutherland Springs, Texas, with some calling for action on gun control as the death toll mounted. Trump said his ""thoughts and prayers"" are with the victims and their families, but he did not suggest plans to take any legislative or other policy action to address the shooting. Sunday's shooting  happened in the late morning during Sunday service , causing a flood of lawmakers from across the country to offer their condolences and statements about gun violence in America. ""As my colleagues go to sleep tonight, they need to think about whether the political support of the gun industry is worth the blood that flows endlessly onto the floors of American churches, elementary schools, movie theaters, and city streets,"" Connecticut Democratic Sen. Chris Murphy said in a statement. Murphy has been a vocal supporter of gun control since the shooting at Sandy Hook Elementary School in Newtown, Connecticut, in 2012 killed 20 children and six adults. The renewed calls for action on gun control follow the recent massacre in Las Vegas, which killed 58 people and injured nearly 500, making it the deadliest shooting in modern US history. Former Arizona Democratic Rep. Gabby Giffords, who has pushed for gun control since she was shot in the head in an assassination attempt in 2011, called the frequency of mass shootings ""alarming"" and ""not normal"" in a tweet Sunday night. Rep. Steve Scalise, a Republican from Louisiana  who was critically injured in a mass shooting  at a congressional baseball practice in Alexandria, Virginia, in June, praised the first responders who arrived at the scene in Sutherland. Ted Cruz and John Cornyn, also commented on the shooting in their home state, offering thoughts and prayers to the victims and their families and praising the first responders. Rep. Henry Cuellar, a Democrat from Texas who represents Sutherland Springs, said in a statement that he is monitoring the investigation and offered local officials ""the full resources"" of his office. ""The President has been briefed several times and is continuing to receive regular updates on the tragic shooting"" in Texas, White House press secretary Sarah Sanders said, adding that Trump had spoken with Abbott."	55	6
2016-04-22	http://www.foxnews.com/politics/2016/04/22/under-construction-kinder-gentler-ted-cruz.html	Under construction – a kinder, gentler Ted Cruz	15	2	Texas	 Cruz's campaign knows that in order to boost his numbers, he needs to reach out to Americans beyond those who listen to conservative talk radio and know the senator from his fights with Republican leaders on Capitol Hill, including his 21-hour filibuster against President Barack Obama's health care law that resulted in a government shutdown.	84	8
2017-08-22	https://www.cnn.com/2017/08/18/us/unmasking-antifa-anti-fascists-hard-left/index.html	Unmasking the leftist Antifa movement	11	1	Virginia	" While Antifa members don't fit a single category, they say many are millennials and many live on society's fringes: undocumented immigrants, transgender people, low-wage workers, those who don't conform to the traditional 9-to-5. And white nationalists, neo-Nazis and others -- who have been blamed for provoking violence at last week's ""Unite the Right"" rally in Charlottesville, Virginia -- claim it was Antifa groups that first got aggressive. ""There are people who were energized by Bernie (Sanders) that now are anarchists,"" said an organizer of the website It's Going Down, a newsblog for Antifa. In New York's Union Square on May Day, a masked member of the Antifa group Metropolitan Anarchist Coordinating Council told CNN why he wore black bloc and waved a black flag. ""It is new, and this, like, this rumble mentality of, 'I'm going to bring my friends, you're going bring your friends, and we're going to fight it out in the park' -- it's not something we've seen here,"" Simpson said. It's a perspective several Antifa activists shared with CNN, even knowing that violence has led to hundreds of arrests across the country."	31	6
2010-08-03	http://www.foxnews.com/us/2010/08/03/va-police-illegal-immigrant-charged-killing-nun-injuring-car-crash.html	Va. police: Illegal immigrant charged with killing nun and injuring 2 others in car crash	12	2	Virginia	 ADVERTISEMENT A local official in the Virginia suburb where the crash happened and a congressman from another state have criticized federal officials for not removing the suspect from the country after previous arrests, and even U.S.   Secretary   questioned why his deportation was taking so long. Twenty-three-year-old Carlos Martinelly Montano, who police say is illegally in the country, is charged with drunken driving, involuntary manslaughter and felony driving on a revoked license after the accident on Sunday in Virginia's   County. Police say Montano, who is from  , was turned over to Immigration and Customs Enforcement after at least one arrest, and a prosecutor said he knew of at least one other occasion he'd been referred to immigration officials. Prince William County's top elected leader and a Kentucky congressman, both Republicans, criticized federal immigration officials for not deporting Montano. Sister Glenna Smith says the Catholic nuns have always provided social services — including adult literacy courses and counseling — regardless of immigration status, and they are upset the tragedy has become fodder for policy debate.	27	5
2014-09-10	http://www.foxnews.com/us/2014/09/10/veterans-marriage-equality-bid-fails-in-partisan-vote.html	Veterans Marriage Equality Bid Fails in Partisan Vote	17	2	Texas	" ADVERTISEMENT The proposal, in the form of an amendment to a bill calling for the VA secretary to meet with certain advisory committees about veterans' health care, failed 13-12 on an almost strictly partisan vote on the House Veterans Affairs Committee. The amendment was proposed by Rep. Dina Titus, D-Nevada, who called on House Veterans Affairs Committee members to show ""one ounce of the courage [veterans] have"" and approve the amendment. Rep. Beto O'Rourke, D-Texas, likened the current system, in which the VA yields to state policy on same-sex marriages for the purposes of benefits, to earlier state laws barring or not recognize interracial marriages. Rep. Jeff Miller, R-Florida, chairman of the committee, spoke against the proposal, saying that the current law predates same-sex marriage, and the state's role in determining the legal definition of marriage has been backed by the Supreme Court. ""In determining if a person is or was the spouse of a veteran ... the marriage shall be proven as valid [by the VA] according to the law of the place where they resided at the time of the marriage or when the benefits accrued,"" Miller said. Rep. David Jolly, R-Florida, told the panel he agreed with Titus' amendment, and said it was wrong that a veteran who would be getting benefits for a gay spouse while living in Nevada would lose them by moving to Florida."	83	6
2018-02-22	https://www.cnn.com/2018/02/16/politics/mike-pence-border/index.html	Vice President Mike Pence visits the Texas-Mexico border	15	1	Texas	"  (CNN) Vice President Mike Pence travels to the Texas-Mexico border on Friday in his first visit to the area as vice president. The vice president will travel to the border before President Donald Trump has been able to make such a trip, though Trump has said several times he plans to travel to see border wall prototypes. Sister Norma Pimentel, director of the Humanitarian Respite Center in McAllen, told CNN that she has been invited to meet with the vice president. She will also emphasize why she believes a border wall is not the answer to the issue of immigration and urge Pence to meet with members of the community for a better understanding of the potential impact a border wall -- a Trump administration priority -- would have on the region and its people. The Rio Grande Valley has been seen as ground zero for the immigration debate, as it's among the busiest areas for Border Patrol agents. Tickets started at $2,700 per person for lunch and go up to $35,000 for a couple to meet in a small group with the vice president, according to a person familiar with the event. John-Michael Torres, the communications director for local immigrant advocacy group LUPE (La Union Del Pueblo Entero), is organizing a news conference at a segment of border wall in Hidalgo, Texas, on Friday afternoon -- one of the cities Pence is scheduled to visit for an up-close look at the Rio Grande and a border crossing. While Torres said he doesn't expect the group's message to be seen or heard by the vice president, he thinks it's important to express local concern over Trump's proposed border wall: ""Today's visit is symbolic of the anti-immigrant, pro-wall policies that President Trump has been pushing out. We do not want Vice President Pence to leave without him hearing from local communities who continue to reject the notion of a border wall."""	82	5
