2017-08-04	https://www.cnn.com/2017/08/04/politics/2020-vision-cory-booker-marijuana-deval-patrick-kamala-harris/index.html	#2020Vision: Booker's bold marijuana move; Obama world loves Patrick; Why Sanders supporters are attacking Harris	11	1	Virginia	  (CNN) Our weekly roundup of the news, notes and chatter about the prospects for the next Democratic presidential race: New Jersey Sen.  Cory Booker  is making the national legalization of marijuana a centerpiece of his  new racial justice bill  -- staking out a position that goes far beyond the decriminalization other Democrats have backed. From a 2020 perspective, Booker's bill is important for two reasons: African-Americans are a hugely important part of the Democratic electorate, starting in South Carolina -- and blacks are disproportionately hit by harsh enforcement marijuana laws. Two things you need to know about Patrick: 1) He's a managing director at Bain Capital -- yes,  that  Bain Capital, the one where  Mitt Romney  worked -- where Patrick oversees investments in companies that address social problems. ANOTHER ZUCKERBERG POLITICAL HIRE : Facebook CEO  Mark Zuckerberg   added another presidential campaign veteran  this week, with Democratic pollster  Joel Benenson  -- the pollster for Obama and a top adviser to  Hillary Clinton  -- joining Zuckerberg and wife  Priscilla Chan 's nonprofit as a consultant. The week ahead: Sunday, August 6 -- Former Missouri secretary of state  Jason Kander  headlines the Maine Democratic Party's Muskie  Lobster Bake  at 12 p.m. Friday, August 11 -- The Iowa Democratic  Wing Ding dinner  in Clear Lake, featuring Kander, California Rep.  Eric Swalwell  and Maryland Rep.  Elijah Cummings , kicks off at 5 p.m. CT. Before you go: Mark Cuban  is giving attorney general  Jeff Sessions   credit  for going after doctors and pharmacies in combatting the opioid crisis.	64	6
2018-02-09	https://www.cnn.com/2018/02/09/politics/2020-vision-julian-castro-interested/index.html	#2020Vision: Castro: 'Yeah, I'm interested' in 2020; the Obamaworld primary; Gillibrand rejects Rubio-Ivanka family leave plan	15	1	Texas	 Washington (CNN) Our weekly roundup of the news, notes and chatter about the prospects for the next Democratic presidential race :  Julián Castro  isn't being coy about what his trip to New Hampshire next week to speak to young Democrats in Manchester means: He's weighing a 2020 presidential run. Biden is the universally known, seasoned veteran whose authenticity could be an antidote to President  Donald Trump ; Patrick is the former  David Axelrod  client who Obama himself sees as a top-level talent; and if Holder's push to flip governor's office and state legislatures this fall is successful, he'll have credibility for having done the real work of reversing Democrats' down-ballot fortunes. ANOTHER PREVIEW OF THE COMING HEALTH CARE BRAWL:  Andy Slavitt , acting CMS administrator under Obama and leading defender of the Affordable Care Act during the GOP's 2017 push to gut it, unveiled a new initiative this week to build bipartisan consensus around health care policy.	65	8
2017-06-30	https://www.cnn.com/2017/06/30/politics/2020-vision-kirsten-gillibrand-single-payer/index.html	#2020Vision: Gillibrand backs single-payer; Booker's Facebook Live; Kander goes to New Hampshire	11	1	Virginia	" Washington (CNN) Our weekly roundup of the news, notes and chatter about the prospects for the next Democratic presidential race: Add another major 2020 Democratic player to the list of supporters of single-payer health insurance: Sen.  Kirsten Gillibrand . It positions her with Sanders, progressive activists, and as of this week, Massachusetts Sen.  Elizabeth Warren , who  told The Wall Street Journal  that on health care, ""now it's time for the next step. Democrats generally want to set aside the topic of single-payer while they are fighting President  Donald Trump 's effort to repeal and replace the Affordable Care Act, also known as Obamacare. News and notes:  Booker's Facebook Live : That  Cory Booker   Facebook Live  started with just the New Jersey senator and Rep.  John Lewis  of Georgia, the civil rights icon. — Booker's ties to Wall Street are too close for many progressives' comfort — and sometimes, as in his refusal to join most Democrats in calling for a full repeal of  Jared Kushner 's security clearance, he plays it safe. The Senate's ""no"" caucus : Booker, Gillibrand and others, including Minnesota Sen.  Al Franken , Virginia Sen.  Tim Kaine  and Connecticut Sen.  Chris Murphy , have said they don't want to run for president. —  Joe  and  Jill Biden  also  launched  Monday the new Biden Cancer Initiative, a private venture meant to work in tandem with Biden's ""Moonshot"" program. Warren's advice : Massachusetts Sen.  Elizabeth Warren   gave a bit of a pep talk  to  Samantha Bee  this week, telling her that the way to respond to Trump's presidency is to fight. Murphy gets a challenger : Connecticut Sen.  Chris Murphy  got his first  challenger  headed into the 2018 midterms:  Dominic Rapini , a Branford businessman who was inspired by Trump's win. The ""stars"" of 2020 : Speaking of New Hampshire,  the Concord Monitor  named Facebook's  Mark Zuckerberg ,  Oprah Winfrey ,  Mark Cuban , Starbucks founder  Howard Schultz ,  Dwayne ""The Rock"" Johnson  and actor  Tom Hanks  among the Democratic 2020 prospects, extending an invitation to meet with its editorial board to all of them. The week ahead: — Monday, July 3: California Sen.  Kamala Harris  will speak at a citizenship ceremony for 41 children and young people from 14 countries. — Thursday, July 6:  We talked last week  about  Jason Kander 's visit to Iowa. — Friday, July 7: A Republican event to watch: Nebraska Sen.  Ben Sasse , a prominent Trump critic, will  speak  at a Story County, Iowa, GOP dinner at 6 p.m. CT. Iowa Republican chairman  Jeff Kaufmann  recently lambasted Sasse for his Trump criticism,  saying : ""You know what Sen. Sasse, I really don't care what you like — we love Donald Trump! The view from the left:  Notes from CNN's Greg Krieg: Former Ohio state Sen.  Nina Turner , one of  Bernie Sanders ' top surrogates during the 2016 primary contest, is the new president of ""Our Revolution,"" the political organization spawned by his campaign. Translation: Turner, an electric speaker and beloved on the progressive left, can fire up the grassroots in a way that Weaver, who rankled the younger, digital-native Sanders campaign vets (a number of whom resigned when he was appointed last year), could not."	56	2
2017-11-17	https://www.cnn.com/2017/11/17/politics/2020-vision-kirsten-gillibrand-clinton-resign/index.html	#2020Vision: Gillibrand starts the Clinton debate; Kaine wants superdelegates eliminated; Booker gets an endorsement	11	1	Virginia	" Washington (CNN) Our weekly roundup of the news, notes and chatter about the prospects for the next Democratic presidential race: New York Sen.  Kirsten Gillibrand  — who holds what was once  Hillary Clinton 's seat — just placed herself at the forefront of a Democratic re-evaluation of  Bill Clinton 's legacy. ""It's going to be a conversation for society and the Democratic Party for months and years to come, I think,"" former  Barack Obama  aide  Dan Pfeiffer   said  on the ""Pod Save America"" podcast Thursday. News and notes: KAINE: ELIMINATE SUPERDELEGATES: The 2016 Democratic vice presidential nominee, Virginia Sen.  Tim Kaine , sided with Vermont independent Sen.  Bernie Sanders  and called on the party to eliminate superdelegates. AN ENDORSEMENT BOOKER WON'T WANT: New Jersey Sen.  Robert Menendez , celebrating the mistrial in his corruption case Wednesday, praised home-state Sen.  Cory Booker  for backing him and then delivered a 2020 endorsement Booker might not want: ""He's a public servant with an unlimited potential who can easily  serve our country in the highest office  in the land,"" Mendendez said. The Washington Post's  Paul Kane  made an interesting point in  a recent chat with CNN's  Chris Cillizza : ""The distance from 74 to 86 is big for any human, let alone one that would spend eight years of that span in the toughest job in the world,"" Kane said. — An interesting comment from Massachusetts Rep.  Seth Moulton , a 2020 prospect and lock for vice presidential short lists himself, on Biden: ""I love  Joe Biden ; he has been a mentor to me and he is someone I was supporting in the primary before he decided not to run in last year's election,"" Moulton said. — Vice's  Eve Peyser   throws cold water  on the idea Biden could win a Democratic primary, pointing out — among other things — his role in the  Anita Hill  sexual harassment hearing in 1991, his involvement passing a 1994 crime bill, his anti-populist trade stance and some potentially controversial abortion positions. The week ahead: — Friday, November 17 —  Joe Biden 's book tour swings through Washington with an 8 p.m. — Friday, November 17 — Reps.  Tim Ryan  of Ohio,  John Delaney  of Maryland and  Grace Meng  of New York are the out-of-state headliners at the New Hampshire Democratic Party's Kennedy Clinton dinner. — Sunday, November 19 — Biden holds a book tour event at the Schermerhorn Symphony Center in Nashville, Tennessee, at 7:30 p.m. CT.  Before you go: California Rep.  Adam Schiff  is making a trip to an early-voting state."	86	8
2018-01-05	https://www.cnn.com/2018/01/05/politics/2020-vision-surveying-the-field/index.html	#2020Vision: Surveying the 30-plus candidate 2020 field; a Sanders reunion in Michigan; Steyer to announce his plans	11	1	Virginia	" Washington (CNN) Our weekly roundup of the news, notes and chatter about the prospects for the next Democratic presidential race: The list of Democratic lawmakers, governors and public figures considering 2020 presidential runs into the 30s — and seems to grow every week. As 2018 kicks off, we'll start our weekly roundup with a quick survey of the field as it looks currently, based on which 2020 prospects are dominating headlines, making visits to early-voting states and more:  Discussion of 2020 has to start with the three potential candidates around whom the rest of the field has to strategize: Vermont Sen.  Bernie Sanders , who is still traveling the country like a candidate and would  start with a much stronger early-state organization  than he had in 2016; former Vice President  Joe Biden , who's universally known and is seen as authentic, a valuable commodity in this era; and Massachusetts Sen.  Elizabeth Warren , who is immensely popular with the progressive base and has been  carefully maneuvering  to  address her potential weaknesses . Then there's an almost-as-prolific trio of senators who have emerged as powerful foils to the Trump administration: New York Sen.  Kirsten Gillibrand , whose role in ousting Democratic Sen.  Al Franken  over sexual misconduct allegations  positioned her to lead the same charge  against President  Donald Trump ; California Sen.  Kamala Harris , who emerged as a star in her first year in office and, along with Warren and two other Democrats, just  introduced a major Wall Street oversight bill ; and New Jersey Sen.  Cory Booker , who recently made  a push for marijuana legalization  as part of his broader racial justice effort. DE BLASIO'S EVOLVING ALLIANCES: From the department of ""my, how much things have changed,"" New York City Mayor  Bill de Blasio  — who  slipped in a trip to Iowa before New Year's  — was  sworn in for his second term  on January 1 by  Bernie Sanders ."	73	8
2017-11-03	https://www.cnn.com/2017/11/03/politics/2020-vision-elizabeth-warren-rigged/index.html	#2020Vision: Warren: 'Yes,' 2016 was rigged; New Hampshire on Biden's mind; Big week for McAuliffe's legacy	11	1	Virginia	" Washington (CNN) Our weekly roundup of the news, notes and chatter about the prospects for the next Democratic presidential race: Massachusetts Sen.  Elizabeth Warren   took a side  in the Democratic Party's roiling divide over 2016 — and set the terms for moving past it — with her one-word answer when CNN's  Jake Tapper  asked Thursday afternoon whether the primary was, in her view, rigged against  Bernie Sanders . She also made news by becoming the second Democrat, after California Sen.  Kamala Harris , to say she'll oppose a budget deal if Congress hasn't extended protections for those previously covered by former President  Barack Obama 's Deferred Action for Childhood Arrivals (or ""DACA"") program, which Trump is rescinding. Also in New Hampshire  this weekend : Massachusetts Rep.  Seth Moulton , who will campaign for young Democratic candidates in Nashua alongside  Colin Van Ostern , the party's 2016 nominee for governor. KAINE ADDRESSES SEXISM:  Virginia Sen.  Tim Kaine ,  Hillary Clinton 's 2016 running mate,  wrote an op-ed in Esquire magazine  this week calling on men to join the fight to ensure equal opportunity for women. Democrats will be watching the Virginia and New Jersey governor's races, and hope to win a Washington state senate seat that would give the party unified control of the government there."	53	8
2018-02-01	https://www.cnn.com/2018/02/01/politics/tbt-2016-iowa-caucus-trump/index.html	#TBT: If at first you don't succeed, go on to win the presidency	15	1	Texas	 Few examples back up this piece of advice like Donald Trump's reaction to his 2016 second place finish in the Iowa caucuses, which happened on this day in 2016. In  one of the last polls  before the first in the nation 2016 Iowa caucuses, then-candidate Trump had a five-point lead over Sen. Ted Cruz.	85	8
2018-02-23	https://www.cnn.com/2018/02/23/entertainment/ted-cruz-the-simpsons/index.html	'Simpsons' showrunner slams Ted Cruz for saying characters are Republicans	15	1	Texas	" The senator from Texas ran afoul of the showrunner for ""The Simpsons"" after he invoked the characters during an appearance Thursday at the Conservative Political Action Conference, or CPAC. Ted Cruz embraces Trump ahead of re-election ""The Democrats are the party of Lisa Simpson,"" Cruz said of the character who is portrayed on the show as being a bit of a know-it-all. ""And Republicans are happily the party of Homer, Bart, Maggie and Marge."" Al Jean, showrunner for the long-running animated Fox series, struck back on Twitter saying Cruz needed the character of baby Maggie's pacifier. ""Ted Cruz says Maggie Simpson would vote for him,"" Jean tweeted. Jean also joked that with the ""way things are going even Mr. Burns (the show's billionaire character) is thinking of becoming a Democrat."" ""The Simpsons"" is known for getting political and even had an episode in 2000 that predicted Donald Trump would become President (with Lisa Simpson being elected after him and inheriting his budget crisis). 'The Simpsons' remain our psychics Cruz made his comments during an interview with ""The Federalist"" founder Ben Domenech, who compared the current gun control debate to a ""Simpsons"" episode. During a 1997 episode of the series titled ""The Cartridge Family,"" patriarch Homer Simpson purchases a gun, much to the disapproval of his wife, Marge. When Homer argues he has to have a gun because ""it's in the Constitution,"" daughter Lisa argues, ""Dad, the Second Amendment is just a remnant from Revolutionary days. Twitter had a field day over Cruz calling Lisa Simpson a Democrat, with one user tweeting, ""Lisa is the only intelligent character in the family. ""The Simpsons"" former showrunner, Bill Oakley, has his own ideas about the characters' political affiliations. As for Homer, Oakley wrote, ""He may be Republican because the joke with Homer, as everyone knows, is that he is poorly-informed and reactionary in the extreme."""	56	6
2017-01-03	https://www.cnn.com/2016/11/14/world/2016-in-review-fast-facts/index.html	2016 In Review Fast Facts	11	1	Virginia	"  (CNN) Here is a look back at the events of 2016. Notable US Events: January 26 -  After occupying a federal wildlife refuge headquarters in Oregon for 26 days to denounce federal land policies, protest leader Ammon Bundy and several fellow occupiers are pulled over on US Highway 395. February 25 -  Cedric Ford, 38, kills three people and injures an additional 14 in shootings that end at his workplace , a lawn care machinery manufacturing company in Hesston, Kansas. April 20 -  Five former  New Orleans police officers plead guilty and are sentenced  in connection with the  shootings of six unarmed people, two fatally, on the Danziger Bridge  days after  Hurricane Katrina. April 27 -   Former Speaker of the House Dennis Hastert  is  sentenced to 15 months in prison  and ordered to pay $250,000 to a victims' fund in a hush money case that revealed he was being accused of sexually abusing young boys as a teacher in Illinois. May 26 -  Jairam Hathwar, 13, of Corning, New York, and Nihar Janga, 11, of Austin, Texas, are named co-champions of the 2016  Scripps National Spelling Bee  competition, the third set of co-champions in three years. May 28 -  The Cincinnati Zoo shoots and kills Harambe , a 17-year old, 400-pound western lowland gorilla, after a child slips into the animal's enclosure. June 28 -  After a two-year investigation of the  Benghazi terror attack ,  House Republicans release a more than 800-page report  faulting the Obama administration for security lapses which led to the deaths of four Americans, but contains no revelations likely to further damage Hillary Clinton. July 7-8 -  Five police officers are killed, and seven other officers and two civilians are wounded  when a sniper fires ambush-style during a peaceful protest in downtown Dallas. July 27 -  A federal judge grants  John Hinckley Jr. , the man who shot  President Ronald Reagan  in 1981, ""full-time convalescent leave"" from St. Elizabeths Hospital. August 10 -  The  Justice Department releases a report  showing that the Baltimore Police Department has engaged in unconstitutional practices that led to disproportionate rates of stops, searches and arrests of African-Americans, and excessive use of force against juveniles and people with mental health disabilities. September 16 -   Tulsa Police Officer Betty Shelby fatally shoots Terence Crutcher , a 40-year-old unarmed black man, after his car is found abandoned in the middle of the road. September 23 -   Five people are killed after a gunman opens fire at a Washington state mall  in Burlington, an hour north of Seattle. September 29 -  A New Jersey commuter train crashes  into the Hoboken Terminal during morning rush hour, leaving one dead and more than 100 injured. October 28 -  In a letter to Congress,  FBI Director James Comey says the FBI is reviewing new emails related to Hillary Clinton's time as secretary of state . November 4 -  Two former officials linked to New Jersey Governor Chris Christie's office are found guilty  on all charges in connection with the closure of lanes in 2013 on the George Washington Bridge in an apparent act of political retribution, the fallout for which has come to be known as Bridgegate. November 22 -  The Dow Jones Industrial Average  closes at 19,023.87, the first close above 19,000. November 28 -  An Ohio State University student drives his car into a group of people on the Columbus campus and then charges at passersby with a knife,  injuring 11. December 2 -  At least 36 people  die in a  fire at an Oakland, California, converted warehouse  where an electronic dance party was being held. December 5 -  The judge declares a mistrial  on the fourth day of deliberations in the murder trial of Michael Slager, a former police officer charged with killing an unarmed black motorist in North Charleston, South Carolina. December 15 -   A jury finds Dylann Roof guilty of all 33 federal charges he faced  after last year's massacre at a historically black church in Charleston, South Carolina. March 27 -  On Easter Sunday, a  suicide blast in a park in the eastern Pakistan city of Lahore  kills 69 people and injures more than 340 others. July 3 -  A suicide car bomb detonates in a busy shopping district in Baghdad, Iraq,  killing at least 292 people, and injuring at least 200. July 15-16 -  During an  attempted coup  by a faction of the military in Turkey, at least 290 people died and more than 1,400 were wounded. September 20 -  A Brazilian judge rules that there is enough evidence for former  Brazilian President Luiz Inacio Lula da Silva , his wife and six others to stand trial on corruption charges, relating to the state-run oil company Petrobus. September 27 -   Islamic militant Ahmad al-Faqi al-Mahdi is sentenced to nine years in prison  after pleading guilty to war crimes for destroying religious and historic monuments in the ancient city of Timbuktu, Mali. October 24 -  At least 61 people are killed and 117 injured when  militants attack a police training academy in Quetta, Pakistan. December 9 -  Lawmakers in South Korea's National Assembly  vote, 234-56, to impeach President Park Geun-hye  over a corruption scandal. December 10 -  A  church in the Nigerian city of Uyo collapses  during services Saturday, killing at least 23 people. December 10 -  Forty-four people, mostly police officers, are killed and 155 wounded in  twin bombings in Istanbul . December 11 -   A car filled with explosives rams into the main entrance of a port in Mogadishu, Somalia , killing at least 20 people and injuring 15, most of whom were port employees and pedestrians. December 19 -  A tractor-trailer runs into a Christmas market in a major public square in Berlin, killing 12 people and injuring 48. December 23, 2016 -   The UN Security Council approves a resolution which calls on Israel to ""immediately and completely cease all settlement activities in the occupied Palestinian territory, including East Jerusalem."" December 31, 2016 -  Two suicide bombers carry out an attack in Baghdad, killing at least 28 people. Notable Deaths in 2016: Dale Bumpers - January 1 Mike Oxley - January 1 Vilmos Zsigmond - January 1 Robert Stigwood - January 4 Pat Harrington - January 6 André Courrèges - January 7 David Bowie  - January 10 Monte Irvin - January 11 David Margulies - January 11 Alan Rickman - January 14 Dan Haggerty - January 15 Glenn Frey - January 18 Abe Vigoda - January 26 Paul Kantner - January 28 Bob Elliott - February 2 Joe Alaskey - February 3 Dave Mirra - February 4 Edgar Mitchell - February 4 Maurice White - February 4 Antonin Scalia  - February 13  George Gaynes - February 15 Denise Matthews ""Vanity"" - February 15     Boutros Boutros-Ghali - February 16 Umberto Eco - February 19 Harper Lee  - February 19 Sonny James - February 22 George Kennedy - February 28 Bud Collins - March 4 Pat Conroy - March 4 Joey Feek - March 4 Nancy Reagan  - March 6  Sir George Martin - March 8 Keith Emerson - March 10 Frank Sinatra Jr. - March 16 Larry Drake - March 17 Rob Ford - March 22 Joe Garagiola Sr.- March 23 Ken Howard - March 23 Garry Shandling - March 24 James Noble - March 28 Patty Duke - March 29 Zaha Hadid - March 31 Merle Haggard - April 6 Will Smith III - April 9 David Gest - April 12 Anne Jackson - April 12 Doris Roberts - April 17 Joanie Laurer ""Chyna"" - April 20 Prince  - April 21  Madeleine LeBeau - May 1 Guy Clark - May 17 Morley Safer - May 19 Alan Young - May 19 Muhammad Ali  - June 3  Kevin ""Kimbo Slice"" Ferguson - June 6 Theresa Saldana - June 6 Gordie Howe - June 10 Christina Grimmie - June 10 Michu Meszaros - June 12 Ann Morgan Guilbert - June 14 Attrell Cordes - June 17 Ron Lester - June 17 Anton Yelchin - June 19 Bernie Worrell - June 24 Bill Cunningham - June 25 Scotty Moore - June 28 Pat Summitt  - June 28  Michael Cimino - July 2 Elie Wiesel  - July 2  Noel Neill - July 3 Garry Marshall - July 19  Timothy LaHaye - July 25 Youree Dell Harris ""Miss Cleo"" - July 26 Jack Davis - July 27 David Huddleston - August 2 Pete Fountain - August 6 Kenny Baker - August 13 Jack Riley - August 19 Steven Hill - August 23 Juan Gabriel - August 28 Gene Wilder - August 29 Jon Polito - September 1 Hugh O'Brian - September 5 Phyllis Schlafly - September 5 Lady Chablis - September 8 Alexis Arquette - September 11 Edward Albee - September 16 W.P. Kinsella - September 16 Charmian Carr - September 17 Curtis Hanson - September 20 Stanley Dural Jr., ""Buckwheat Zydeco"" - September 24 Bill Nunn - September 24 José Fernández - September 25 Arnold Palmer  - September 25  Gloria Naylor - September 28 Agnes Nixon  - September 28 Shimon Peres - September 28 King Bhumibol Adulyadej of Thailand - October 13 Pete Burns - October 23 Tom Hayden - October 23 Tammy Grimes - October 30 Janet Reno - November 7 Leonard Cohen - November 7 Gwen Ifill - November 14 Florence Henderson - November 24 Fidel Castro  - November 25 Ron Glass - November 26 Jayaraman Jayalalithaa - December 5 Joseph Mascolo - December 7 John Glenn  - December 8 Alan Thicke - December 13 Craig Sager -   December 15 Zsa Zsa Gabor  - December 18 Richard Adams - December 24 George Michael - December 25 Vera Rubin - December 25 Ricky Harris - December 26 George S. Irving - December 26 Carrie Fisher  - December 27 Debbie Reynolds  - December 28 Keion Carpenter - December 29 Tyrus Wong - December 30 William Christopher - December 31"	29	6
