2018-03-13	https://www.cnn.com/2018/03/13/politics/foreign-policy-congress-tillerson/index.html	On Capitol Hill, a day of chaos follows Tillerson firing: 'I heard about it from y'all'	15	1	Texas	 Even in Washington, which has become acclimated to a rigorous pace of news dominated with presidential tweets, staff shake-ups and quickly evolving storylines, President Donald Trump's announcing his decision Tuesday took members of Congress (as it did Tillerson)  by surprise . The chairman of the Senate's Foreign Relations Committee, Republican Sen. Bob Corker of Tennessee, learned Tillerson was leaving from news reports and didn't get a call from Trump until 9:58 a.m. The Senate -- already swamped with a banking bill, sex trafficking legislation and an upcoming federal spending deal -- learned Tuesday that it would now have to devote significant floor time not only to confirming Tillerson's replacement, who Trump named as CIA Director Mike Pompeo, but also to confirming a new CIA director to replace Pompeo.	30	6
2017-10-03	https://www.cnn.com/2017/10/03/politics/democrats-trump-guns/index.html	On gun control, Democrats see tiny sliver of hope in Trump	4	1	West_Virginia	" RELATED: Democrats are desperate to do something -- anything -- on gun control While some have taken to less than senatorial language to express their frustration -- ""It's time for Congress to get off its ass and do something,"" Sen. Chris Murphy  said in a statement -- others have taken to sarcasm ."	32	6
2017-10-03	https://www.cnn.com/2017/10/03/politics/democrats-trump-guns/index.html	On gun control, Democrats see tiny sliver of hope in Trump	11	1	Virginia	" RELATED: Democrats are desperate to do something -- anything -- on gun control While some have taken to less than senatorial language to express their frustration -- ""It's time for Congress to get off its ass and do something,"" Sen. Chris Murphy  said in a statement -- others have taken to sarcasm ."	39	6
2017-06-23	https://www.cnn.com/2017/06/23/politics/mitch-mcconnell-health-care/index.html	One week. 52 senators. Can Mitch McConnell get it done?	15	1	Texas	" RELATED: What's inside the Senate Republican health care bill Over the next few days, McConnell needs to determine what concessions he can make to sway at least two of the four conservative senators -- but do so without losing support from the more moderate wing of the Senate, some of whom face tough re-elections next year. ""It's going to be rocky next week, like you saw with the House bill,"" a senior White House official said, comparing the ongoing negotiations to a game of ""whack-a-mole"" -- a reference to the challenge of balancing any changes that win over one group while risking losing another. RELATED: Senate math: Republicans have very little margin for error on health care The difficult votes to win On both the moderate and conservative sides of the party, some of the lawmakers that may be the toughest for McConnell to get to a yes are the same ones who may have to rely on his generosity for their re-elections."	56	2
2018-03-14	https://www.cnn.com/2018/03/14/politics/paul-ryan-pennsylvania-reaction/index.html	Paul Ryan on Republican struggling in Pennsylvania race: 'Both of these candidates ran as conservatives'	11	1	Virginia	"  (CNN) House Speaker Paul Ryan sought to explain Pennsylvania's special election outcome --  where a Democrat is poised to deliver a stunning upset  to the GOP in a district Donald Trump handily won in 2016 -- as a race between ""two conservatives."" Speaking to reporters at the weekly Republican leadership news conference Wednesday, Ryan defined Democrat Conor Lamb as a ""pro-life, pro-gun, anti-Nancy Pelosi conservative"" and noted that there wasn't a Democratic primary that would have pulled Lamb to the left. While the Wisconsin Republican argued Republicans need to focus on their legislative track record in Congress and avoid being outraised, he still said he doubts this will become a trend in Republican-leaning districts because there wasn't a primary. He said he supports abortion rights but personally opposes abortion -- a position that matches Virginia Sen. Tim Kaine, the 2016 Democratic vice presidential nominee. He toed the Democratic line on health care, aired advertisements opposing Ryan-backed reforms to Medicare and Social Security, and hammered the Republican tax bill, arguing it would balloon the deficit and lead to cuts to entitlement programs. Asked by CNN if this  should also be ""a wakeup call"" to the President , Ryan argued that Trump helped make the race as close as it is. ""I think the President helped close this race,"" he said, a reference to the campaigning Trump did in the district over the previous weekend. The public polling wasn't looking so good and the President came in and helped close this race and got it to where it is right now, which is within a few hundred votes."" While he took a few questions on the race, Ryan appeared to grow tired of talking about Pennsylvania. As one reporter toward the end started to ask another question about the race, Ryan moved on to a different reporter. There was some crosstalk and laughter, but ultimately Ryan never answered the question and took questions on an upcoming appropriations fight instead. Republican leaders also touted the tax reform plan and sought to portray how taxpayers would be affected if Democrats took control and passed their own tax plan."	65	8
2017-11-07	https://www.cnn.com/2017/11/07/politics/rand-paul-return-mitch-mcconnell/index.html	Paul's expected return soothes heartburn for McConnell	15	1	Texas	  (CNN) After Kentucky Sen. Rand Paul suffered  a painful rib injury  when he was allegedly assaulted by a neighbor, Senate Majority Leader Mitch McConnell was asked what a potentially prolonged Paul absence could mean for the GOP agenda. While many of the gory details of what exactly prompted Paul's neighbor, Dr. Rene Boucher, to allegedly assault the Republican senator -- and exactly how five of his ribs were broken -- are unknown, authorities and Boucher's lawyer say it was prompted by a trivial, long simmering, and  now very public and embarrassing dispute over yard waste . For now, it doesn't appear Republicans will lose any roll call votes because of Paul's convalescence at his home in a gated community in Bowling Green. Paul's absence did require two votes scheduled for Monday evening to be postponed until Tuesday because Sen. Ted Cruz, R-Texas, who was dealing with aftermath of the church shooting in Texas, was also away. With several veteran GOP senators dealing with illnesses -- including John McCain of Arizona, Thad Cochran of Mississippi and Johnny Isakson of Georgia -- every vote is critical for GOP leaders. That maybe why Majority Whip John Cornyn, who oversees corralling votes, sent Paul a text message Monday to check in on him.	24	6
2018-02-09	https://www.cnn.com/2018/02/09/opinions/pelosi-and-the-democrats-sold-out-the-dreamers-rosas/index.html	Pelosi and the Democrats sold out the Dreamers	11	1	Virginia	 Greisa Martinez Rosas would qualify for the Dream Act and serves as the Advocacy Director of United We Dream, the largest immigrant youth-led organization in the country. (CNN) This week, House Democratic Leader Nancy Pelosi spoke in Congress for eight hours straight about immigrant youth. Yet, while she was speaking, Democratic and Republican party leaders  were writing a budget deal  that would leave protections for immigrant youth out in exchange for dollars on other projects. At a CNN town hall one year ago, House Speaker  Paul Ryan told my friend Angelica  that she would be safe, yet we now live in danger of being picked up and taken to detention centers by Donald Trump's Immigration and Customs Enforcement squads. And Thursday night, Nancy Pelosi failed to whip her caucus to use its leverage to protect us, as 73 Democrats voted with Republicans for the budget deal and secured nothing from Paul Ryan. In this leadership moment, where they had their opportunity to fight back against Trump's racist policies,  the Democrats stood down  and the deportations continue to escalate. Immigrant youth and our allies in cities, towns, and states across the country have generated bipartisan, broad and deep support for passage of the Dream Act in Congress. As ICE and Border Patrol agents board buses and trains to ask citizens and non-citizens alike for their papers, as children are dragged to detention camps and thousands of immigrant youth lose their jobs and become vulnerable, one has to wonder what it will take. Since Trump announced last fall that he was ending the DACA program,  more than 19,000 immigrant youth  have lost their protections from deportation, 850 more lose it every week and on March 5, Trump has decided that it will end for all of us. Just weeks ago at the Women's March, I watched former Democratic Vice Presidential nominee Sen. Tim Kaine speak of his admiration for immigrant youth to great applause. Immigrant youth, people of color, faith leaders, women and millions of allies are putting our bodies on the line every day to resist Trump and fight for a better and fairer country. Leader Pelosi, House Democrats and the Republicans who say they stand with immigrant youth and the promise of Lady Liberty have a decision to make.	71	5
2016-10-30	https://www.cnn.com/2016/10/30/politics/pence-kaine-fbi-clinton-email-review/index.html	Pence praises, Kaine criticizes FBI director	11	1	Virginia	" Washington (CNN) Mike Pence praised FBI Director James Comey's ""real leadership"" on Sunday, while Tim Kaine denounced his ""extremely puzzling"" decision to look at newly discovered emails to see if they are pertinent to the investigation of Hillary Clinton's private server. Clinton chairman turns up heat on FBI ""It was just incomprehensible this summer, when the director of the FBI came out and he literally indicted Hillary Clinton in the press and then said we're not recommending that she be indicted,"" Pence said. In an interview on ABC's ""This Week,"" Democratic vice presidential nominee Kaine called Comey's Friday letter ""extremely puzzling"" and an ""unprecedented move ... because it happens close to an election, which is in violation of normal Justice Department protocol. The hubris of the 2016 candidates ""If he (Comey) hasn't seen the emails, I mean they need to make that completely plain -- then they should work to see the emails and release the circumstances of those once they have done that analysis,"" he said."	58	6
2017-10-26	https://www.cnn.com/2017/10/26/politics/pentagon-congress-niger-briefing/index.html	Pentagon officials brief Congress on Niger attack	15	1	Texas	  (CNN) The Pentagon on Thursday provided lawmakers with a classified briefing detailing what the agency has uncovered so far in its investigation of the Niger ambush that left four US service members dead, amid swirling questions on Capitol Hill about the larger US strategy in Africa in the wake of the attack. Leaving the back-to-back briefings for the House and Senate Armed Services Committee, lawmakers said there are still many unanswered questions, including why it took 48 hours to recover the body of Sgt. Several noted that the head of US Africa Command, Gen. Thomas Waldhauser, told Congress in testimony earlier this year that he only had 20% to 30% of his command's intelligence, surveillance and reconnaissance needs fulfilled. House Armed Services chairman Mac Thornberry told reporters that he's hoping to get all the answers to what happened in Niger as quickly as possible, but he understands it's going to take time -- particularly because US investigators will need the cooperation of the French and Nigerien governments.	75	6
2018-02-21	https://www.cnn.com/2018/02/21/politics/trump-worst-president-ever-maybe-not/index.html	Political scientists rate Trump as worst ever, but you should be skeptical	15	1	Texas	 Indeed, there is good reason to be cautious in using this study of political scientists to determine what Trump's place in history is at this point or what it will ultimately be. Given that Trump's approval rating nationally  among Democrats is in the single digits , it shouldn't be too surprising that his ranking among a very Democratic-leaning sample of political scientists is quite low. Interestingly, the survey also found that Republican political scientists were also not fans of Trump. Although there is no reliable polling data that I'm aware of on Republican political scientists and their vote choice in 2016, I decided to take a look at how the precincts around some college campuses voted in the 2016 Republican presidential primary. Even among political scientists, these surveys don't necessarily stay consistent. Ulysses Grant, who was president in the 1870s, rose from 28th in a 2014 survey of political scientists to 21st in this one. (Jackson, by the way, is a favorite of Trump's, so that could also be attention that hasn't helped him with this crowd.)	40	6
2018-04-10	https://www.cnn.com/2018/04/10/politics/mike-pompeo-confirmation-senators/index.html	Pompeo moves to court moderate Dems ahead of tough vote in committee	4	1	West_Virginia	"  (CNN) President Donald Trump's nominee to be secretary of state, facing an uphill climb to win Senate confirmation, is moving behind the scenes to win over moderate Democratic senators who could provide a lifeline to his nomination once it reaches the Senate floor. But in an unusual move, Pompeo is already privately courting moderate Democratic senators who don't serve on that committee, in what lawmakers in both parties say is a sign of the significant challenges facing the nomination. Already, Pompeo has lost the support of Republican Rand Paul, a Kentucky senator who serves on the committee, which is a significant defection given the GOP's one-vote advantage on the panel. But both senators have been skeptical of Pompeo's nomination to State, as many Democrats raise concerns over his hawkish views and worry he won't be an independent voice willing to stand up to Trump. And in the event that all committee Democrats vote against his nomination and Paul votes ""no,"" Republicans would be forced to take procedural steps to advance the nomination to the floor without a recommendation from the panel, amounting to a rebuke to the nominee. But with a narrowly divided chamber,  Sen. John McCain absent as he recovers  from brain cancer and if Paul remains a ""no"" vote, Pompeo would need at least one Democratic senator to break ranks to advance the nomination. ""I think it's way too early to make that prediction,"" said Sen. Ben Cardin, a Maryland Democrat and a member of the panel who met with Pompeo for 45 minutes Tuesday but made clear he still has concerns about the nominee. Pompeo won the support of King and 14 Democrats as CIA director, but nearly all of them have made clear that they view the State Department much differently and are approaching this vote more skeptically. During that time, two Cabinet-level nominees were rejected on the floor of the Senate after failing to win approval in committee, including John Tower as secretary of defense in 1989 and John Bolton in 2005, who was filibustered by Senate Democrats to be United Nations ambassador before being installed as a recess appointment by then-President George W. Bush. McMaster as national security adviser with John Bolton The chairman of the Senate Foreign Relations Committee, Bob Corker, said Tuesday it's premature to say whether the GOP leadership will advance the nomination to the floor should Pompeo lose support in the committee. A source familiar with Pompeo's confirmation prep said he's met with many senators not on the committee, in addition to lawmakers who serve on the panel, including Menendez."	51	8
2018-04-10	https://www.cnn.com/2018/04/10/politics/mike-pompeo-confirmation-senators/index.html	Pompeo moves to court moderate Dems ahead of tough vote in committee	11	1	Virginia	"  (CNN) President Donald Trump's nominee to be secretary of state, facing an uphill climb to win Senate confirmation, is moving behind the scenes to win over moderate Democratic senators who could provide a lifeline to his nomination once it reaches the Senate floor. But in an unusual move, Pompeo is already privately courting moderate Democratic senators who don't serve on that committee, in what lawmakers in both parties say is a sign of the significant challenges facing the nomination. Already, Pompeo has lost the support of Republican Rand Paul, a Kentucky senator who serves on the committee, which is a significant defection given the GOP's one-vote advantage on the panel. But both senators have been skeptical of Pompeo's nomination to State, as many Democrats raise concerns over his hawkish views and worry he won't be an independent voice willing to stand up to Trump. And in the event that all committee Democrats vote against his nomination and Paul votes ""no,"" Republicans would be forced to take procedural steps to advance the nomination to the floor without a recommendation from the panel, amounting to a rebuke to the nominee. But with a narrowly divided chamber,  Sen. John McCain absent as he recovers  from brain cancer and if Paul remains a ""no"" vote, Pompeo would need at least one Democratic senator to break ranks to advance the nomination. ""I think it's way too early to make that prediction,"" said Sen. Ben Cardin, a Maryland Democrat and a member of the panel who met with Pompeo for 45 minutes Tuesday but made clear he still has concerns about the nominee. Pompeo won the support of King and 14 Democrats as CIA director, but nearly all of them have made clear that they view the State Department much differently and are approaching this vote more skeptically. During that time, two Cabinet-level nominees were rejected on the floor of the Senate after failing to win approval in committee, including John Tower as secretary of defense in 1989 and John Bolton in 2005, who was filibustered by Senate Democrats to be United Nations ambassador before being installed as a recess appointment by then-President George W. Bush. McMaster as national security adviser with John Bolton The chairman of the Senate Foreign Relations Committee, Bob Corker, said Tuesday it's premature to say whether the GOP leadership will advance the nomination to the floor should Pompeo lose support in the committee. A source familiar with Pompeo's confirmation prep said he's met with many senators not on the committee, in addition to lawmakers who serve on the panel, including Menendez."	65	8
2014-08-07	http://www.foxnews.com/us/2014/08/07/president-obama-signs-163b-bill-to-overhaul-va.html	President Obama Signs $16.3B Bill to Overhaul VA	17	2	Texas	" ADVERTISEMENT The $16.3 billion Veterans Access, Choice and Accountability Act expands community healthcare options for veterans who face long wait times or commutes; funds the hiring of more doctors, nurses and other health-care workers; and improves accountability by making it easier for the agency secretary to fire problem executives. ""This legislation will go a long way toward ending unacceptably long waiting times for veterans to access health care and allow the VA the resources to hire the doctors, nurses and other medical staff it needs to address these problems over the long term."" In  a letter to McDonald dated Aug. 4, Miller said agency health care officials testified several times that a VA review of 250 million consults since 1999 determined that 23 patients died from gastrointestinal illnesses because of delays in medical consultation. “And we’ll be working with and we’ll be watching the VA to make sure they’re carried out and that the money is spent wisely, so veterans get the health care they need.” Celli said the Legion will also be watching how McDonald fares during his first few months on the job."	51	6
2010-08-08	http://www.foxnews.com/politics/2010/08/08/push-virginia-follow-arizonas-lead-anti-immigration-law-nuns-death.html	Push in Virginia to Follow Arizona's Lead on Anti-Immigration Law After Nun's Death	12	2	Virginia		40	5
2018-03-07	https://www.cnn.com/2018/03/07/app-news-section/quickly-catch-up-march-7-trnd/index.html	Quickly catch up on the day's news	17	1	Texas	" -- Republican Ted Cruz's re-election campaign was ""just having a sense of humor"" when releasing an ad teasing Democratic candidate Rep. Beto O'Rourke for going by Beto rather than his given name, Robert. Here's how O'Rourke responded --  Porn star Stormy Daniels sued President Trump,  accusing him of never signing a ""hush agreement"" over an alleged sexual encounter."	39	6
2018-03-07	https://www.cnn.com/2018/03/07/politics/ted-cruz-texas-primary-ad-cnntv/index.html	Rafael (Ted) Cruz justifies mocking Robert (Beto) O'Rourke's name	17	1	Texas	" Washington (CNN) Sen. Ted Cruz said Wednesday that his re-election campaign was ""just having a sense of humor"" when it  released a radio ad t easing Rep. Beto O'Rourke, who won the Democratic primary, for going by Beto rather than his given name, Robert. ""In terms of the jingle, some of it is just having a sense of humor,"" Cruz told CNN's ""New Day."" ""We had some fun with it."" Cruz, meanwhile, goes by Ted instead of his given name -- Rafael Edward Cruz. ""You're absolutely right. My name is Rafael Edward Cruz,"" Cruz acknowledged. ""I am the son of my father Rafael Cruz, an immigrant from Cuba who came to Texas with nothing."" O'Rourke, however, declined to respond to Cruz's name-calling. Appearing on ""New Day"" after Cruz, O'Rourke said, ""I just don't think that's what folks in Texas want us to focus on."" ""We can get into name-calling and talk about why the other person is such an awful guy, or we can focus on the big things we want to do for the future of our country, for the generations that will succeed us,"" he said, later adding, ""We can focus on the small, mean, petty stuff, or we can be big, bold, courageous, and confident."""	100	8
2017-09-12	https://www.cnn.com/2017/09/12/politics/paul-congress-war-vote/index.html	Rand Paul likely to get a war vote	11	1	Virginia	"  (CNN) After threatening to scuttle all amendments on a massive defense policy bill, Sen. Rand Paul is likely to secure a vote on ending the war authorizations the US military uses to fight terrorism across the globe. Paul's office announced he would get a vote Wednesday on the Kentucky Republican's amendment that would repeal the 2001 and 2002 war authorizations after six months, giving Congress time to pass a new Authorization for Use of Military Force for the wars against Al Qaeda, ISIS and the Taliban. Senate leaders appear to have agreed to give Paul a vote on his amendment to the National Defense Authorization Act after he threatened to object to all other amendments, which would have effectively prevented any amendments from getting a vote on the massive defense policy bill. Paul's amendment likely faces an uphill climb to be adopted onto the defense bill, as many lawmakers have expressed concern about repealing the authorization the US military uses to fight ISIS and Al Qaeda without first replacing it. Sen. Tim Kaine, a Virginia Democrat who has joined forces with Arizona Republican Sen. Jeff Flake of Arizona to draft a new war authorization, says he's likely to back Paul's amendment. In the House, the appropriations committee approved an amendment from California Democratic Rep. Barbara Lee to repeal the 2001 AUMF, but House Republican leaders used a procedural tactic to strip the amendment before the defense appropriations bill passed on the floor. If Paul drops his objections to other amendments -- and no other senators raise their own -- there are a number of other contentious issues that might get votes on the defense policy bill, although there are hundreds of amendments that have been offered. And Sen. Tom Cotton has proposed an amendment that would end the sequestration budget caps for both defense and non-defense spending, which as currently written would prevent the Pentagon's proposed $54 billion budget increase from taking shape."""	53	6
